{
  "$schema": "./schema.json",
  "schemaVersion": 1,
  "source": {
    "kind": "official-reference-document-extraction",
    "title": "Cypher Reference Document (2026)",
    "file": "Cypher-Reference-Document-2026-07-29.docx",
    "sha256": "cbc222b131436fef77b75af80c362a6cf67f0baa70c9380ccac3a3a31964d626",
    "license": "2026 Cypher Open License",
    "note": "Candidate content only; requires in-Foundry review before promotion."
  },
  "target": {
    "systemId": "magnusarchives",
    "futurePackId": "species"
  },
  "inventory": {
    "fantasy": [
      "Dragonfolk",
      "Dwarf",
      "Elf",
      "Gnome",
      "Halfling",
      "Hellborn",
      "Human",
      "Orc"
    ],
    "scienceFiction": [
      "Aarak",
      "Cyborg",
      "Delph",
      "D’nec",
      "Drakain",
      "Human",
      "Mutant",
      "Naron",
      "Prota",
      "Rigellian",
      "Stelan",
      "Vendeer",
      "Zantari"
    ]
  },
  "counts": {
    "species": 20
  },
  "review": {
    "status": "candidate",
    "manualTreatment": [
      "Dwarf recovery bonus remains descriptive; no RecoveryService automation is introduced.",
      "D’nec additional Intellect recovery remains descriptive; no targeted recovery automation is introduced.",
      "Mutant's adapted tier 1 Focus Ability remains a manual player/GM choice with no Ability catalog.",
      "Natural-1 exceptions, conditional damage, resistance, movement, telepathy, Assets, and turn denial remain descriptive."
    ],
    "human": "One shared Human document covers both Fantasy and Science Fiction appearances and offers one dynamic all-available-Descriptors choice."
  },
  "species": [
    {
      "name": "Dragonfolk",
      "type": "species",
      "_id": "f042637bbdd2b4c4",
      "img": "systems/magnusarchives/assets/icons/magnusspecies.png",
      "system": {
        "schemaVersion": 1,
        "slug": "dragonfolk",
        "description": "<p>Scaled and descended from dragons, you share a kinship with some of the mightiest creatures that ever winged their way across the world. You might have been born of dragonfolk parents, willingly transformed in a magical ceremony, or chosen by a dragon to be their agent or champion—or you might have no idea why you are the way you are. Some claim you have a great destiny, but whether you believe that is up to you.</p><p><strong>You gain the following characteristics:</strong></p><ul><li><p>You don’t get a GM intrusion if you roll a 1 on a block task.</p></li><li><p>You are trained in intimidation (except against other dragonfolk and dragons).</p></li><li><p>Choose an energy (acid, cold, fire, and so on); you inflict +1 damage when you attack with this energy.</p></li></ul><aside class=\"species-callout\"><p>Work with your GM if you want your dragonfolk character to have a breath weapon. You can easily adapt one of your type or focus abilities, such as Blast, Shroud of Flame, Lightning Hand, or something similar, so the effect is produced from your breath instead of as presented in the ability description.</p></aside>",
        "source": {
          "uuid": "",
          "book": "Cypher Reference Document (2026)",
          "page": "100",
          "license": "2026 Cypher Open License"
        },
        "automation": {
          "mode": "descriptive",
          "duration": {
            "enabled": false,
            "trigger": "recovery"
          },
          "rollDefaults": {}
        },
        "ruleElements": [],
        "tags": [
          "species",
          "fantasy"
        ],
        "grantedBy": {
          "kind": "other",
          "sourceUuid": "",
          "instanceId": "",
          "grantId": "",
          "status": "active",
          "contentUuid": "",
          "contentKey": "",
          "replacement": {
            "active": false,
            "originalName": "",
            "originalContentUuid": "",
            "originalContentKey": "",
            "replacementName": "",
            "replacementContentUuid": "",
            "replacementContentKey": "",
            "selectionKind": "none"
          }
        },
        "poolBonuses": {
          "might": 0,
          "speed": 0,
          "intellect": 0
        },
        "woundBonuses": {
          "minor": 0,
          "moderate": 0,
          "major": 0
        },
        "edgeGrant": {
          "mode": "none",
          "pool": "none",
          "amount": 1
        },
        "weaponUse": {
          "light": false,
          "medium": false,
          "heavy": false
        },
        "weaponFamilies": [],
        "armorUse": {
          "light": false,
          "medium": false,
          "heavy": false
        },
        "cypherLimitBonus": 0,
        "skillGrants": [
          {
            "id": "b7bfc3e24ae23b3d",
            "skillUuid": "Compendium.magnusarchives.skills.Item.TxjNz86eOB6UwTGb",
            "customName": "",
            "notes": "<p>Except against other dragonfolk and dragons.</p>",
            "rank": "trained",
            "snapshot": {
              "name": "Intimidation",
              "img": "systems/magnusarchives/assets/icons/magnusskill.png",
              "system": {
                "defaultPool": "choose",
                "schemaVersion": 1,
                "slug": "",
                "description": "<p>You’re good at swaying others with threatening words and/or a fearsome presence.</p><blockquote><h6>Positive and Negative Social Interactions</h6><ul><li><p>Any truthful positive social interaction is covered by charm.</p></li><li><p>Any untruthful positive social interaction is covered by deception.</p></li><li><p>Any negative social interaction is covered by intimidation.</p></li></ul></blockquote>",
                "source": {
                  "uuid": "",
                  "book": "",
                  "page": "",
                  "license": "original"
                },
                "automation": {
                  "mode": "descriptive",
                  "duration": {
                    "enabled": false,
                    "trigger": "recovery"
                  },
                  "rollDefaults": {}
                },
                "ruleElements": [],
                "tags": [],
                "grantedBy": {
                  "kind": "other",
                  "sourceUuid": "",
                  "instanceId": "",
                  "grantId": "",
                  "status": "active",
                  "contentUuid": "",
                  "contentKey": "",
                  "replacement": {
                    "active": false,
                    "originalName": "",
                    "originalContentUuid": "",
                    "originalContentKey": "",
                    "replacementName": "",
                    "replacementContentUuid": "",
                    "replacementContentKey": "",
                    "selectionKind": "none"
                  }
                },
                "rank": "untrained",
                "category": "general",
                "contexts": [],
                "initiative": false,
                "acquisition": {
                  "minimumTier": 1,
                  "grantedByUuid": "",
                  "notes": ""
                }
              }
            },
            "alternatives": []
          }
        ],
        "choiceGroups": [],
        "abilityGrants": [],
        "abilityChoiceGroups": [],
        "descriptorGrants": [],
        "descriptorChoiceGroups": [],
        "instance": {
          "sourceUuid": "",
          "instanceId": "",
          "role": "primary",
          "attachedAt": 0,
          "selections": {
            "edgePool": "none",
            "superheroicsPool": "none",
            "powerShifts": [],
            "poolChoices": [],
            "skillChoices": [],
            "abilityChoices": [],
            "descriptorChoices": [],
            "suppressedGrantIds": []
          },
          "parent": {
            "kind": "other",
            "sourceUuid": "",
            "instanceId": "",
            "grantId": "",
            "status": "active",
            "contentUuid": "",
            "contentKey": "",
            "replacement": {
              "active": false,
              "originalName": "",
              "originalContentUuid": "",
              "originalContentKey": "",
              "replacementName": "",
              "replacementContentUuid": "",
              "replacementContentKey": "",
              "selectionKind": "none"
            }
          }
        }
      },
      "effects": [],
      "folder": null,
      "sort": 0,
      "ownership": {
        "default": 0
      },
      "flags": {},
      "_stats": {
        "coreVersion": "14.360",
        "systemId": null,
        "systemVersion": null,
        "createdTime": null,
        "modifiedTime": null,
        "lastModifiedBy": null,
        "compendiumSource": null,
        "duplicateSource": null,
        "exportSource": null
      },
      "_key": "!items!f042637bbdd2b4c4"
    },
    {
      "name": "Dwarf",
      "type": "species",
      "_id": "0b6d6a0587878026",
      "img": "systems/magnusarchives/assets/icons/magnusspecies.png",
      "system": {
        "schemaVersion": 1,
        "slug": "dwarf",
        "description": "<p>You’re a stocky, broad-shouldered, bearded native of the mountains and hills. You’re also as stubborn as the stone in which the dwarves carve their homes under the mountains. Tradition, honor, pride in smithcraft and warcraft, and a keen appreciation of the wealth buried under the roots of the world are all part of your heritage. Those who wish you ill should be wary of your temper. When dwarves are wronged, they never forget.</p><p><strong>You gain the following characteristics:</strong></p><ul><li><p>You add +1 on recoveries.</p></li><li><p>You are trained in navigation (if underground or in mountainous areas).</p></li><li><p>You inflict +1 damage with axes.</p></li></ul>",
        "source": {
          "uuid": "",